<?xml version="1.0" encoding="UTF-8" standalone="yes" ?>
<DailyyogaMIIT xmlns:xsi="http://www.w3.org/2001/XMLSchema-instance"
    xsi:noNamespaceSchemaLocation="droidAssist.xsd">
    <Global>
        <Filter>
            <Exclude>com.dailyyoga.plugin.droidassist.LogTransform</Exclude>
            <Exclude>com.dailyyoga.plugin.droidassist.ReflectionTransform</Exclude>
            <Exclude>com.dailyyoga.plugin.droidassist.PrivacyApiTransform</Exclude>
            <Exclude>android.*</Exclude>
            <Exclude>com.android.*</Exclude>
            <Exclude>okhttp3.*</Exclude>
            <Exclude>com.xiaomi.account.openauth.internal.MiAccountPhoneInfo</Exclude>
        </Filter>
    </Global>

    <Replace>
        <MethodCall>
            <Source>
                int android.util.Log.v(java.lang.String,java.lang.String)
            </Source>
            <Target>
                $_= com.dailyyoga.plugin.miit.LogTransform.v($$);
            </Target>
        </MethodCall>
        <MethodCall>
            <Source>
                int android.util.Log.v(java.lang.String,java.lang.String,java.lang.Throwable)
            </Source>
            <Target>
                $_= com.dailyyoga.plugin.droidassist.LogTransform.v($$$);
            </Target>
        </MethodCall>

        <MethodCall>
            <Source>
                int android.util.Log.d(java.lang.String,java.lang.String)
            </Source>
            <Target>
                $_= com.dailyyoga.plugin.droidassist.LogTransform.d($$);
            </Target>
        </MethodCall>
        <MethodCall>
            <Source>
                int android.util.Log.d(java.lang.String,java.lang.String,java.lang.Throwable)
            </Source>
            <Target>
                $_= com.dailyyoga.plugin.droidassist.LogTransform.d($$$);
            </Target>
        </MethodCall>

        <MethodCall>
            <Source>
                int android.util.Log.i(java.lang.String,java.lang.String)
            </Source>
            <Target>
                $_= com.dailyyoga.plugin.droidassist.LogTransform.i($$);
            </Target>
        </MethodCall>
        <MethodCall>
            <Source>
                int android.util.Log.i(java.lang.String,java.lang.String,java.lang.Throwable)
            </Source>
            <Target>
                $_= com.dailyyoga.plugin.droidassist.LogTransform.i($$$);
            </Target>
        </MethodCall>

        <MethodCall>
            <Source>
                int android.util.Log.w(java.lang.String,java.lang.String)
            </Source>
            <Target>
                $_= com.dailyyoga.plugin.droidassist.LogTransform.w($$);
            </Target>
        </MethodCall>
        <MethodCall>
            <Source>
                int android.util.Log.w(java.lang.String,java.lang.String,java.lang.Throwable)
            </Source>
            <Target>
                $_= com.dailyyoga.plugin.droidassist.LogTransform.w($$$);
            </Target>
        </MethodCall>
        <MethodCall>
            <Source>
                int android.util.Log.w(java.lang.String,java.lang.Throwable)
            </Source>
            <Target>
                $_= com.dailyyoga.plugin.droidassist.LogTransform.w($$);
            </Target>
        </MethodCall>

        <MethodCall>
            <Source>
                int android.util.Log.e(java.lang.String,java.lang.String)
            </Source>
            <Target>
                $_= com.dailyyoga.plugin.droidassist.LogTransform.e($$);
            </Target>
        </MethodCall>
        <MethodCall>
            <Source>
                int android.util.Log.e(java.lang.String,java.lang.String,java.lang.Throwable)
            </Source>
            <Target>
                $_= com.dailyyoga.plugin.droidassist.LogTransform.e($$$);
            </Target>
        </MethodCall>

        <MethodCall>
            <Source>
                int android.util.Log.wtf(java.lang.String,java.lang.String)
            </Source>
            <Target>
                $_= com.dailyyoga.plugin.droidassist.LogTransform.wtf($$);
            </Target>
        </MethodCall>
        <MethodCall>
            <Source>
                int android.util.Log.wtf(java.lang.String,java.lang.String,java.lang.Throwable)
            </Source>
            <Target>
                $_= com.dailyyoga.plugin.droidassist.LogTransform.wtf($$$);
            </Target>
        </MethodCall>
        <MethodCall>
            <Source>
                int android.util.Log.wtf(java.lang.String,java.lang.Throwable)
            </Source>
            <Target>
                $_= com.dailyyoga.plugin.droidassist.LogTransform.wtf($$);
            </Target>
        </MethodCall>

        <MethodCall>
            <Source>
                java.lang.Object
                java.lang.reflect.Method.invoke(java.lang.Object,java.lang.Object[])
            </Source>
            <Target>
                $_= com.dailyyoga.plugin.droidassist.ReflectionTransform.invoke($$);
            </Target>
        </MethodCall>

        <MethodCall>
            <Source>
                android.location.Location
                android.location.LocationManager.getLastKnownLocation(java.lang.String)
            </Source>
            <Target>
                $_= com.dailyyoga.plugin.droidassist.PrivacyApiTransform.getLastKnownLocation($);
            </Target>
            <Filter>
                <Exclude>com.alipay.security.mobile.module.deviceinfo.e</Exclude>
            </Filter>
        </MethodCall>

        <MethodCall>
            <Source>
                java.util.List android.content.pm.PackageManager.getInstalledPackages(int)
            </Source>
            <Target>
                $_= com.dailyyoga.plugin.droidassist.PrivacyApiTransform.getInstalledPackages($);
            </Target>
        </MethodCall>

        <MethodCall>
            <Source>
                java.util.List android.content.pm.PackageManager.getInstalledApplications()
            </Source>
            <Target>
                $_= com.dailyyoga.plugin.droidassist.PrivacyApiTransform.getInstalledApplications();
            </Target>
        </MethodCall>

        <MethodCall>
            <Source>
                java.lang.String
                android.provider.Settings$Secure.getString(android.content.ContentResolver,java.lang.String)
            </Source>
            <Target>
                $_= com.dailyyoga.plugin.droidassist.PrivacyApiTransform.getString($$);
            </Target>
        </MethodCall>

        <MethodCall>
            <Source>
                java.lang.String
                android.telephony.TelephonyManager.getDeviceId()
            </Source>
            <Target>
                $_= com.dailyyoga.plugin.droidassist.PrivacyApiTransform.getDeviceId();
            </Target>
        </MethodCall>
        <MethodCall>
            <Source>
                java.lang.String
                android.telephony.TelephonyManager.getDeviceId(int)
            </Source>
            <Target>
                $_= com.dailyyoga.plugin.droidassist.PrivacyApiTransform.getDeviceId($);
            </Target>
        </MethodCall>

        <MethodCall>
            <Source>
                java.lang.String
                android.telephony.TelephonyManager.getImei()
            </Source>
            <Target>
                $_= com.dailyyoga.plugin.droidassist.PrivacyApiTransform.getImei();
            </Target>
        </MethodCall>
        <MethodCall>
            <Source>
                java.lang.String
                android.telephony.TelephonyManager.getImei(int)
            </Source>
            <Target>
                $_= com.dailyyoga.plugin.droidassist.PrivacyApiTransform.getImei($);
            </Target>
        </MethodCall>

        <MethodCall>
            <Source>
                java.lang.String
                android.telephony.TelephonyManager.getSubscriberId()
            </Source>
            <Target>
                $_= com.dailyyoga.plugin.droidassist.PrivacyApiTransform.getSubscriberId();
            </Target>
        </MethodCall>

        <MethodCall>
            <Source>
                java.lang.String
                android.net.wifi.WifiInfo.getMacAddress()
            </Source>
            <Target>
                $_= com.dailyyoga.plugin.droidassist.PrivacyApiTransform.getMacAddress();
            </Target>
        </MethodCall>

        <MethodCall>
            <Source>
                java.lang.String
                java.net.NetworkInterface.getHardwareAddress()
            </Source>
            <Target>
                $_= com.dailyyoga.plugin.droidassist.PrivacyApiTransform.getHardwareAddress();
            </Target>
        </MethodCall>
    </Replace>

</DailyyogaMIIT>